goodsNo,리뷰번호,리뷰타입,작성자,리뷰내용,평점,체험단,구매옵션,키,몸무게,성별,작성일,만족도,사진유무,도움돼요,브랜드,카테고리,구매사이즈,구매상세,연도,월,일,요일,평점_raw,만족도_응답여부,사이즈,화면대비색감,퀄리티,구김,두께감,신축성,퀄리티_점수,신축성_점수,두께감_점수,구김_점수,사이즈_편차,사이즈_편차절대,화면대비색감_편차,화면대비색감_편차절대,리뷰내용_clean,리뷰내용_norm,laugh_count,cry_count,exclamation_count,question_count,emoji_count,has_repetition,text_length_orig,한글_글자수,전체_글자수,is_valid_for_topic,작성자_norm,옵션키,세션,long_gap_review,그룹크기,action,dup_flag,is_base,kept_id
994588,84244248,general,앤틱한노란색의상,"디자인과 색상, 사이즈 전부 다 아주 마음에 듭니다.",5.0,False,XL(옥스포드),180.0,90.0,남성,2026-05-07 11:23:12,사이즈: 정사이즈 / 화면 대비 색감: 화면과 비슷 / 퀄리티: 매우 좋음 / 구김: 약간 있음,False,0,filluminate,상의,XL,(옥스포드),2026,5,7,목,5,응답,정사이즈,화면과 비슷,매우 좋음,약간 있음,,,5.0,,,3.0,0.0,0.0,0.0,0.0,"디자인과 색상, 사이즈 전부 다 아주 마음에 듭니다.",디자인과색상사이즈전부다아주마음에듭니다,0,0,0,0,0,False,29,20,29,True,앤틱한노란색의상,"('XL', '(옥스포드)')",0,False,2,drop,same_option_same_type_dup,False,﻿84244248
5911789,84253456,style,GUARD:,핏이랑 소재 너무 좋은것 같습니다 다들 사셔도 됩니다,5.0,False,CREAM · M,176.0,75.0,남성,2026-05-07 18:10:02,사이즈: 정사이즈 / 화면 대비 색감: 화면과 비슷 / 퀄리티: 보통 / 신축성: 적당함,True,0,filluminate,하의,M,CREAM,2026,5,7,목,5,응답,정사이즈,화면과 비슷,보통,,,적당함,3.0,3.0,,,0.0,0.0,0.0,0.0,핏이랑 소재 너무 좋은것 같습니다 다들 사셔도 됩니다,핏이랑소재너무좋은것같습니다다들사셔도됩니다,0,0,0,0,0,False,29,22,29,True,GUARD:,"('M', 'CREAM')",0,False,2,drop,multi_type_dup,False,84253445
6140883,84260450,general,코미 코미,편안함과 부드러운 소재감과 가벼운 무게감. 루즈한 디자인에 만족해요. 한여름에도 입을 수 있는 얇은 두께에요. 평소 100사이즈 입는데 M사이즈가 맞네요.,5.0,False,M,180.0,67.0,남성,2026-05-07 21:21:35,사이즈: 조금 큼 / 화면 대비 색감: 화면과 비슷 / 퀄리티: 매우 좋음 / 구김: 약간 있음,True,0,filluminate,상의,M,,2026,5,7,목,5,응답,조금 큼,화면과 비슷,매우 좋음,약간 있음,,,5.0,,,3.0,1.0,1.0,0.0,0.0,편안함과 부드러운 소재감과 가벼운 무게감. 루즈한 디자인에 만족해요. 한여름에도 입을 수 있는 얇은 두께에요. 평소 100사이즈 입는데 M사이즈가 맞네요.,편안함과부드러운소재감과가벼운무게감루즈한디자인에만족해요한여름에도입을수있는얇은두께에요평소100사이즈입는데m사이즈가맞네요,0,0,0,0,0,False,86,60,86,True,코미 코미,"('M', None)",0,False,2,drop,multi_type_dup,False,84260383
4987047,84263559,style,wldhksl,적당히 크롭해서 너무 예쁘고 너무 두껍지도 얇지도 않아서 좋았습니다. 비치지도 않고 어디에나 편하게 입기 좋은 기본티인 것 같습니다.,5.0,False,블랙 · L,175.0,65.0,남성,2026-05-07 22:39:07,사이즈: 정사이즈 / 화면 대비 색감: 화면과 비슷 / 두께감: 적당함 / 신축성: 적당함,True,0,jemut,상의,L,블랙,2026,5,7,목,5,응답,정사이즈,화면과 비슷,,,적당함,적당함,,3.0,3.0,,0.0,0.0,0.0,0.0,적당히 크롭해서 너무 예쁘고 너무 두껍지도 얇지도 않아서 좋았습니다. 비치지도 않고 어디에나 편하게 입기 좋은 기본티인 것 같습니다.,적당히크롭해서너무예쁘고너무두껍지도얇지도않아서좋았습니다비치지도않고어디에나편하게입기좋은기본티인것같습니다,0,0,0,0,0,False,74,55,74,True,wldhksl,"('L', '블랙')",0,False,4,drop,multi_type_dup,False,84263252
4987047,84263579,general,wldhksl,적당히 크롭해서 너무 예쁘고 너무 두껍지도 얇지도 않아서 좋았습니다. 비치지도 않고 어디에나 편하게 입기 좋은 기본티인 것 같습니다.,5.0,False,그레이 · L,175.0,65.0,남성,2026-05-07 22:39:32,사이즈: 정사이즈 / 화면 대비 색감: 화면과 비슷 / 두께감: 적당함 / 신축성: 적당함,True,0,jemut,상의,L,그레이,2026,5,7,목,5,응답,정사이즈,화면과 비슷,,,적당함,적당함,,3.0,3.0,,0.0,0.0,0.0,0.0,적당히 크롭해서 너무 예쁘고 너무 두껍지도 얇지도 않아서 좋았습니다. 비치지도 않고 어디에나 편하게 입기 좋은 기본티인 것 같습니다.,적당히크롭해서너무예쁘고너무두껍지도얇지도않아서좋았습니다비치지도않고어디에나편하게입기좋은기본티인것같습니다,0,0,0,0,0,False,74,55,74,True,wldhksl,"('L', '그레이')",0,False,4,drop,multi_option_dup,False,84263252
4987047,84263603,style,wldhksl,적당히 크롭해서 너무 예쁘고 너무 두껍지도 얇지도 않아서 좋았습니다. 비치지도 않고 어디에나 편하게 입기 좋은 기본티인 것 같습니다.,5.0,False,그레이 · L,175.0,65.0,남성,2026-05-07 22:40:05,사이즈: 정사이즈 / 화면 대비 색감: 화면과 비슷 / 두께감: 적당함 / 신축성: 적당함,True,0,jemut,상의,L,그레이,2026,5,7,목,5,응답,정사이즈,화면과 비슷,,,적당함,적당함,,3.0,3.0,,0.0,0.0,0.0,0.0,적당히 크롭해서 너무 예쁘고 너무 두껍지도 얇지도 않아서 좋았습니다. 비치지도 않고 어디에나 편하게 입기 좋은 기본티인 것 같습니다.,적당히크롭해서너무예쁘고너무두껍지도얇지도않아서좋았습니다비치지도않고어디에나편하게입기좋은기본티인것같습니다,0,0,0,0,0,False,74,55,74,True,wldhksl,"('L', '그레이')",0,False,4,drop,multi_option_type_dup,False,84263252
994588,84265881,general,뮤샌샤,사이즈도 적당하고 좋습니다 자주 입을 거 같아요,5.0,False,M(린넨),172.0,71.0,남성,2026-05-07 23:38:23,사이즈: 정사이즈 / 화면 대비 색감: 화면과 비슷 / 퀄리티: 보통 / 구김: 약간 있음,False,0,filluminate,상의,M,(린넨),2026,5,7,목,5,응답,정사이즈,화면과 비슷,보통,약간 있음,,,3.0,,,3.0,0.0,0.0,0.0,0.0,사이즈도 적당하고 좋습니다 자주 입을 거 같아요,사이즈도적당하고좋습니다자주입을거같아요,0,0,0,0,0,False,26,20,26,True,뮤샌샤,"('M', '(린넨)')",0,False,2,drop,same_option_same_type_dup,False,﻿84265881
